{
  "schemaVersion": "d4planner-hud/v1", "hudRevision": 1, "producedAt": "2026-10-25T05:00:01Z",
  "backend": { "runtimeInstanceId": "backend-synthetic-a", "generation": 3 },
  "context": {
    "state": "TARGET_ONLY", "character": null,
    "target": { "targetId": "synthetic-charge-bolt", "displayName": "Synthetic Charge Bolt Equipment Target", "buildDisplayName": "Synthetic Charge Bolt Build", "contentSha256": "aaaaaaaaaaaaaaaaaaaaaaaaaaaaaaaaaaaaaaaaaaaaaaaaaaaaaaaaaaaaaaaa", "selectionRevision": 1, "policyVersion": "d4planner-equipment-policy/v1+r1-equipment-weights/1.0.0" },
    "binding": null, "selectionError": null
  },
  "health": { "capture": "UNKNOWN", "scoreFreshness": "NO_DATA", "ruleKit": "READY" },
  "score": { "status": "NO_DATA", "value": null, "passedWeight": 0, "evaluableWeight": 0, "evaluationCounts": { "evaluatedCriteria": 0, "totalCriteria": 4, "evaluatedWeight": 0, "totalWeight": 8 }, "failIssueCount": 0, "warnCount": 0, "itemsPassing": 0, "itemsTargeted": 2 },
  "equipment": [], "recommendation": null,
  "provenance": { "producer": "D4PLANNER_BE", "assessmentVersion": "d4planner-r1-contract/1.0.0-candidate.3", "captureRevision": null, "lastObservedAt": null }
}
